AdID,AdText,Clicks,Impressions,Age,CreationDate,LandingPage,Placements,Interests,AdSpend,AdSpendCurrency,CreationDateFormatted,AgeAverage,AgeAverageBin,AdSpendBin,ClicksBin,ImpressionsBin
374,join us because we care. black matters.,0.0,137.0,18 - 65+,06/10/15 02:59:53 AM PDT,https://www.facebook.com/Black-Matters-1579673598947501/,News Feed on desktop computers or News Feed on mobile devices,Unavailable,44.87,RUB,2015-06-10,41.5,MidAge,mid,low,mid
655,"not every boy wants to be a soldier. a beautiful message was seen on the streets of the capitol,. with no group name or credits attached to the project. it was the poster at top, of the bearded man in a pink gown behaving like a queen and holding a sign saying ""not every boy wants to be a soldier"". a timely message for today. the two recent u.s. wars were costly for our nation; to put it lightly. they led to domestic devastation of country. no matter what defense secretary or potus are saying they don't fool me with promises of gay military equality as key to the nation's agenda. better talk to me about cutting dod's budget. folks. #igbt #usarmy #crossdress #gaysoldier #obama #defensebudget #stopwar",35.0,452.0,18 - 65+,06/23/15 07:04:01 AM PDT,https://www.facebook.com/LGBT-United-839497472793277/,News Feed on desktop computers or News Feed on mobile devices,Unavailable,184.81,RUB,2015-06-23,41.5,MidAge,mid,mid,mid
664,"""people can tolerate two homosexuals they see leaving together, but the next  day they're smiling, holding hands, tenderly embracing one another, then they  cannot be forgiven. it is not the departure for pleasure that is unacceptable, it  is waking up happy.""  -michel foucault, philosopher and social critic.  #lgbt #homophobia #foucault #society #queerquote",26.0,374.0,18 - 65+,06/23/15 07:02:40 AM PDT,https://www.facebook.com/LGBT-United-839497472793277/,News Feed on desktop computers or News Feed on mobile  devices,Unavailable,99.95,RUB,2015-06-23,41.5,MidAge,mid,mid,mid
325,"california... knows how to party california... knows how to party in the citaaay of l.a. in the citaaay of good of watts in the citaaay, the city of compton we keep it rockin! we keep it rockin! - 2pac - california love",4.0,326.0,18 - 65+,06/10/15 07:34:52 AM PDT,https://www.facebook.com/Black-Matters-1579673598947501/,News Feed on desktop computers or News Feed on mobile devices,Unavailable,45.94,RUB,2015-06-10,41.5,MidAge,mid,mid,mid
326,"since 2010, over 350 of our lives have been taken at the hands of police. those lives of which, were made to be worthless because of our race. each time we die, many of your people, and those who stand by you, justify the taking of our lives, because they believe we are not human, and are not worthy of life. why should we be a target for police violence and harassment?",517.0,1478.0,18 - 65+,06/12/15 03:13:16 AM PDT,https://www.facebook.com/Black-Matters-1579673598947501/,News Feed on desktop computers or News Feed on mobile devices,Unavailable,99.97,RUB,2015-06-12,41.5,MidAge,mid,high,mid
327,"'just like trayvon martin, race mattered for amadou diallo, oscar grant, sean bell, emmett till, and [thousands] more we will never know the name of who died because of their skin color."" - angela davis.        racism is still alive in the usa.",7.0,125.0,18 - 65+,06/11/15 06:51:30 AM PDT,https://www.facebook.com/Black-Matters-1579673598947501/,News Feed on desktop computers or News Feed on mobile devices,Unavailable,34.77,RUB,2015-06-11,41.5,MidAge,mid,mid,mid
328,"race war started by texas teacher a texas fourth-grade teacher karen fitzgibbons published a racial facebook post in which she confirmed that black people are responsible for racial tensions in the usa. moreover she claimed that she is ""almost to the point"" of defending the segregation. after her post about the recent pool party incident drew local attention, the teacher deleted her profile. ""this makes me angry! this officer should not have had to resign. i'm going to just go ahead and say it....the blacks are the ones causing the problems and this ̀ racial tension. i guess that's what happens when you flunk out of school and have no education. i'm sure their parents are just as guilty for not knowing what their kids were doing; or knew it and didn't care,"" she wrote. she also added,""i'm almost to the point of wanting them all segregated on one side of town so they can hurt each other and leave the innocent people alone. maybe the 50s and 60s were really on to something. now, let the bashing of my true and honest opinion begin .... go! #imnotracist #imsickofthemcausingtrouble #itwasagatedcommunity"". as we see karen fitzgibbons is a real racist, who approves the humiliation of black people! this news clearly reflects that american society is close to collapse, if not to say to war. as the authorities are doing nothing to resolve the situation, in the near future we may face real race war within our country.",17.0,168.0,18 - 65+,06/11/15 07:03:58 AM PDT,https://www.facebook.com/Black-Matters-1579673598947501/,News Feed on desktop computers or News Feed on mobile devices,Unavailable,31.54,RUB,2015-06-11,41.5,MidAge,mid,mid,mid
329,"the image of 1938 shows several african american youths dangling around the stairs leading up to the back entrance of a segregated movie theater in anniston, alabama.that day the tarzan film, call of the savage was shown.",18.0,482.0,18 - 65+,06/15/15 07:21:33 AM PDT,https://www.facebook.com/Black-Matters-1579673598947501/,News Feed on desktop computers or News Feed on mobile devices,Unavailable,90.65,RUB,2015-06-15,41.5,MidAge,mid,mid,mid
330,"american racists on the road        the racists group of america ""back to the blue"" are organizing a hate rally in response to the public outcry and protests against police officers. ""bikers-patriots"" want to descend on the mckinney police hq in a show of solidarity for the police because race-baiters and cop-haters. they plan to have ""the biggest thing to happen in patriot movement since the bundy ranch victory!"" it seems like we won't get into ""post-racial america"".... this event and the regular murder of innocent black children by white supremacist police and citizens makes that clear. the modern government has brought racist america to the forefront, good or bad. this is something that america has a serious issue with - racism! is it time to call out the national guard?",24.0,524.0,18 - 65+,06/15/15 07:22:00 AM PDT,https://www.facebook.com/Black-Matters-1579673598947501/,News Feed on desktop computers or News Feed on mobile devices,Unavailable,88.45,RUB,2015-06-15,41.5,MidAge,mid,mid,mid
331,"""free figure's black power rally at vcu:""",43.0,764.0,18 - 65+,06/15/15 07:21:47 AM PDT,https://www.facebook.com/Black-Matters-1579673598947501/,News Feed on desktop computers or News Feed on mobile devices,Unavailable,90.86,RUB,2015-06-15,41.5,MidAge,mid,mid,mid
332,"a woman pretended afro-american to gain control over black community association the president of a local naacp chapter in spokane, washington is under investigation after her parents publicly accused her of lying being african american. both parents of rachel dolezal are white. rachel dolezal also serves as the chair of spokane's office of police ombudsman commission and is an adjunct professor of africana studies at eastern washington university. dolezal falsely identified herself as african-american in order to be appointed as a chair. dolezal's parents paid attention to the official documents, including a birth certificate, confirming that rachel is part swedish, czech, and german with ""traces"" of native american heritage. we see, how whites are trying to gain control over traditionally black organization that protects the rights and interests of the black community. in the dolezal's case it is unlikely it was a mistake or personally motivated fraud. simply she was given a task to join the association of black community in order to control it and hold the interests of white majority. we need a deep inspection of rachel dolezal's activities while she was a president of the local branch of the association of black people! in order not to repeat similar cases in future we need a careful control of all appointments by black community! as it is, there is a dominance of whites in police departments and authorities of cities with a predominantly black population!",47.0,676.0,18 - 65+,06/15/15 07:22:20 AM PDT,https://www.facebook.com/Black-Matters-1579673598947501/,News Feed on desktop computers or News Feed on mobile devices,Unavailable,89.51,RUB,2015-06-15,41.5,MidAge,mid,mid,mid
333,"2pac believed in fight tupac shakur was indeed not just one of the greatest rappers of all time but a worldly icon whose status in hip-hop culture can never be replaced. his revolutionary knowledge mixed with street experience made him powerful unstoppable force that spoke to the hearts of millions of people. his songs touch on a number of engaging topics, including religion, women, oppression, etc. 2pac was a humanitarian, who stood up for those who couldn't stand up for themselves. he believed in fight and speaking the truth. nowadays a lot of singers, both black and white use their music to sell records, just for making money. american society at all levels became too corruptive, starting from our government and ending with ordinary citizens. on the contrary tupac did his music to influence the world. that's why he spoke to issues of poverty, oppression and racism. today young african-americans have fallen under bad influence of money, drugs and so on. yeah, it is all started from the government's attitude towards blacks. but let's remember tupac and his ability to question the social order. changes, one of his popular songs, asks everyone to change their lifestyles for better society. he always asked people to share with each other and to learn to love each other.",47.0,1075.0,18 - 65+,06/16/15 07:36:57 AM PDT,https://www.facebook.com/Black-Matters-1579673598947501/,News Feed on desktop computers or News Feed on mobile devices,Unavailable,174.4,RUB,2015-06-16,41.5,MidAge,mid,mid,mid
334,"today we celebrate the legendary rapper who ever lived: happy b-day, tupac! the greatest of all time rapper is known not only for his music but for the wise words he spoke and his strength in standing up against oppression. his real name was lesane parish crooks. shakur was only 25 years old at the time he was shot and killed in 1996. his killer has never been caught. we will never forget 2pac. today we remember him on what would've been his 44th birthday.",10.0,153.0,18 - 65+,06/16/15 07:37:14 AM PDT,https://www.facebook.com/Black-Matters-1579673598947501/,News Feed on desktop computers or News Feed on mobile devices,Unavailable,90.07,RUB,2015-06-16,41.5,MidAge,mid,mid,mid
335,it is an american history. african-american citizens sat behind signs like these on city buses.,26.0,476.0,18 - 65+,06/16/15 08:20:31 AM PDT,https://www.facebook.com/Black-Matters-1579673598947501/,News Feed on desktop computers or News Feed on mobile devices,Unavailable,84.15,RUB,2015-06-16,41.5,MidAge,mid,mid,mid
336,americans so much effort to hate each other instead of putting the effort into doing something useful. stop racism! we all belong to one human race.,42.0,745.0,18 - 65+,06/17/15 07:41:34 AM PDT,https://www.facebook.com/Black-Matters-1579673598947501/,News Feed on desktop computers or News Feed on mobile devices,Unavailable,175.37,RUB,2015-06-17,41.5,MidAge,mid,mid,mid
337,"no national outrage for an incident at pool party where a black teen was shot to death        today, the pool party in georgia is even more shocking than a recent pool party in texas. a young man from georgia was shot to death at a pool party at fayette. it was an advertised on social 200 teenager's pool party which ended up with shootings of unknown assailant for unknown reasons. one of the five injured, a 19-year-old black teenager clanton passed away on the way to hospital. in fact, the media has not made a transparent effort to cover up the incident. why the pool party in georgia is a silent story? why the police was not aware of a large party? why this story has no national outrage? is it ok when a black teenager dies? unfortunately, the responding police officers were not able to prevent the tragedy. from these facts one might conclude, police officers know the easiest ways to arrest people, but they are irresponsible to avoid the shootings at the average pool party.",23.0,746.0,18 - 65+,06/17/15 07:41:07 AM PDT,https://www.facebook.com/Black-Matters-1579673598947501/,News Feed on desktop computers or News Feed on mobile devices,Unavailable,175.31,RUB,2015-06-17,41.5,MidAge,mid,mid,mid
338,"a 13-year-old child was tasered by cop for skateboarding        a san diego sheriff's deputy was filmed tasering 13-year-old child in the spine for skateboarding. witnesses reported that the cop tried to force them to delete videos from their phones. videos show how the child writhes in agony from being tased. police said that the child ran away from home and was missing for a day-and-half. however it doesn't give the reason to taser a child. we see another case of police misconduct, when the policeman actually attacked the child. this case should reach the court, because the child hasn't done anything unlawful. the policeman exceeded his powers and used force against a child. so he should be punished. before the trial nothing's gonna change and cops are about to do whatever they want. the task of all americans who have witnessed police brutality is to extend all the information about it in order to reach out the government and the court.",97.0,1290.0,18 - 65+,06/17/15 07:41:46 AM PDT,https://www.facebook.com/Black-Matters-1579673598947501/,News Feed on desktop computers or News Feed on mobile devices,Unavailable,270.36,RUB,2015-06-17,41.5,MidAge,mid,mid,mid
339,"only 9 days this year nobody was killed by police        according to data from mapping police violence there are only 9 days this calendar year when nobody was killed by police in the usa. since january 1, 2015 at least 508 people have now been killed by policemen. moreover, analyzing all deaths caused by police, african-american and hispanic people are more likely to be killed than whites. figures show that the index of deaths for black people is 3.45 per million, while for whites it is 1.26 per million. add here military-style equipment and non-lethal weapons, given to cops. and only 0.02 per cent of the nation's police forces are investigated each year. only 0.02! that means, us policemen are immune from criminal changes in their killings. that's why they carry out their daily police raids to destroy the population at the territories under their control.",55.0,1005.0,18 - 65+,06/17/15 07:42:02 AM PDT,https://www.facebook.com/Black-Matters-1579673598947501/,News Feed on desktop computers or News Feed on mobile devices,Unavailable,248.56,RUB,2015-06-17,41.5,MidAge,mid,mid,mid
340,"in early 1900s this black americana chocolate eyes ad art was popular in the usa. they made money from our pain and suffering! though today we don't see such ads, racism still exists in the american society.",21.0,844.0,18 - 65+,06/17/15 07:45:33 AM PDT,https://www.facebook.com/Black-Matters-1579673598947501/,News Feed on desktop computers or News Feed on mobile devices,Unavailable,169.47,RUB,2015-06-17,41.5,MidAge,mid,mid,mid
341,"sadness and shocking tragedy at historically black church in charlestone *click to get live updates on our page* a white gunman opened a fire at pastor and 8 other church members at black church in charlestone, s.0 on wednesday night. the young clean-shaved shooter walked in during a prayer meeting and started shooting the people. charleston police chief greg mullen said that the incident would be investigated as hate crime. emanuel ame church is a historically africa-american church which was found by denmark vesey in order to organize a slave revolt in 1822. despite the first black american president, africa-americans remain the most common victims of hate crimes. but what if the hate crime relates to xenophobia? american xenophobia is based on the dominant white heritage that is giving birth to another form of hate and discrimination. these forms take another level of hate. unfortunately, american tolerance is not what we think it is. us public is swapping patriotism for nationalism, tolerance for islamophobia, racism and anti-immigrant sentiment. for instance, last february american gunman killed three young muslims two miles away from the university of north carolina campus. was this gunman motivated by hate and intolerance? should we expect for more hate-crimes? what if american racial change still occurs through generations? what of it racism happens due to unequal opportunities? what if america is still a deeply racist country? what if the church is not a safe place anymore? #charlestonshooting #chsnews",274.0,5072.0,18 - 65+,06/18/15 04:36:59 AM PDT,https://www.facebook.com/Black-Matters-1579673598947501/,News Feed on desktop computers or News Feed on mobile devices,Unavailable,1295.48,RUB,2015-06-18,41.5,MidAge,high,mid,high
342,"rachel dolezal is wearing the other persons shoes. rachel dolezal drew attention to her racial identification. a white-born former naacp leader claimed to be black. the criticism towards dolezal stems controversy around her identity and her position as the president of the naacp in washington. today. dolezal sees herself as first transracial. rachel dolezal stated that her racial identity was black, american indian; white and two more races. moreover if she proves that she is black; than anyone else will be able to prove that he/she is not even a human being. what do you think about her? what kind of rights should she have?",46.0,866.0,18 - 65+,06/18/15 02:50:25 AM PDT,https://www.facebook.com/Black-Matters-1579673598947501/,News Feed on desktop computers or News Feed on mobile devices,Unavailable,199.94,RUB,2015-06-18,41.5,MidAge,mid,mid,mid
343,"the violent pool story #3. white police officer slammed black teen against his        car this black family from ohio will never forget the june 9th. according to the family's testimony, krystal dixon and her sister maya dixon took their eight children, nephews and nieces to ohio public school in a fairfield. nevertheless, the pool employee demanded the family to leave due to one of the children did not have swim trunks. one of the boys broke the rules and the staff asked the family to leave. as six-months pregnant krystal dixon walked to the parking lot, the police officer grabbed her arm and asked for an id-card. the witness video shows how the police officer pepper sprayed dixon's family and grabbed 12-year-old child by neck. but according to the fairfield police department, the white police officer did not use excessive force. did the pool staff force them to leave because they were black? was it a race factor? don't you think the police officer's attempt to arrest krystal dixon was unlawful? how the police officers should be charged? what kind of right of defense do you have against unlawful arrests? these days, there is far more to being a ""good cop"" than choosing not to hurt innocent people. plus, when are we going to stop being stereotypical? even today, the stereotypes effect black population of the united states of america transmitted through music, lyrics, titles, literature, movies and folk saying. white americans across the country embrace african-americans the image of criminals and looters. how are we going to live with that?",31.0,441.0,18 - 65+,06/18/15 07:21:41 AM PDT,https://www.facebook.com/Black-Matters-1579673598947501/,News Feed on desktop computers or News Feed on mobile devices,Unavailable,91.73,RUB,2015-06-18,41.5,MidAge,mid,mid,mid
344,what else has to happen for you all to realize black lives matter?,59.0,708.0,18 - 65+,06/23/15 07:41:01 AM PDT,https://www.facebook.com/Black-Matters-1579673598947501/,News Feed on desktop computers or News Feed on mobile devices,Unavailable,173.92,RUB,2015-06-23,41.5,MidAge,mid,mid,mid
345,"thousands walk hand in hand across ravenel bridge to show support for mother emanuel church on sunday evening, hours after emanuel a.m.e. church opened its doors for the first service following the killing of nine of its congregants wednesday, thousands in charleston took to the streets in a show of support and solidarity. observers on the bridge, and thousands more at the base, joined hands to create a ""unity chain,"" then held a moment of silence that lasted five minutes in honor of the fallen. police estimated that 10,000 to 15,000 took part in sunday's gathering, according to the post and courier. cars drove slowly past the bridge, taking in the sight and honking horns in solidarity as people chanted ""charleston strong!"" throughout history people start to unite only when they face danger or when they're in times of great sorrow. modern america is accustomed to meet only imaginary dangers, however, americans are getting more and more reasons to sorrow over something day by day. does it mean that the key to the unity of 330 million americans is constant fear and unending sorrow? does it mean that only this can make americans unite and forget about the infighting and differences? unfortunately, yes, it does.",48.0,759.0,18 - 65+,06/23/15 07:41:21 AM PDT,https://www.facebook.com/Black-Matters-1579673598947501/,News Feed on desktop computers or News Feed on mobile devices,Unavailable,258.89,RUB,2015-06-23,41.5,MidAge,mid,mid,mid
346,"whatever the white man has done. black americans have done, and often even better. miss black america in 1969.",65.0,757.0,18 - 65+,06/23/15 07:41:58 AM PDT,https://www.facebook.com/Black-Matters-1579673598947501/,News Feed on desktop computers or News Feed on mobile devices,Unavailable,174.35,RUB,2015-06-23,41.5,MidAge,mid,mid,mid
347,"how many of you believe in black jesus?        there is quite a big number of people arguing about ethnicity of jesus christ. was jesus white, olive-skinned or black? the coptic museum in cairo, egypt owns the earliest painting of jesus christ in the church of rome (6th century) where skin color of jesus was black.",57.0,581.0,18 - 65+,06/23/15 07:42:12 AM PDT,https://www.facebook.com/Black-Matters-1579673598947501/,News Feed on desktop computers or News Feed on mobile devices,Unavailable,174.26,RUB,2015-06-23,41.5,MidAge,mid,mid,mid
348,black is beautiful. god knows what he is doing. the black skin is a glorious symbol of national greatness.,74.0,796.0,18 - 65+,06/23/15 07:42:35 AM PDT,https://www.facebook.com/Black-Matters-1579673598947501/,News Feed on desktop computers or News Feed on mobile devices,Unavailable,174.02,RUB,2015-06-23,41.5,MidAge,mid,mid,mid
349,"a small group of activists burned two confederate flags in response to shooting in charleston, south carolina.        why the symbol of the pro-slavery rebellion is still flying on the ground of south carolina? why the symbol of white supremacy is still flying on the south carolina statehouse in columbia? why the flag that represents the murder of blacks was not removed from the national statehouse? the confederate flag represents terrorism, reminding us about the slavery time, racism and people that were murdered in a hate-crime. today, we ask to remove this symbol of racism that flies 120 miles away from the emanuel african methodist episcopal church in charleston. yes, we must wipe off every single symbol of racism from the united states of america including the confederate flag, kkk and other racist organizations. we must give new names to the streets which were named after racist political figures and slave traders. we must remove monuments dedicated to andrew jackson, robert lee, benjamin huger, james longstreet who owned slaves on their farms. how can we ever expect to get the racist symbols removed until we show ourselves to be men the same as any other race of men?",23.0,412.0,18 - 65+,06/23/15 07:42:57 AM PDT,https://www.facebook.com/Black-Matters-1579673598947501/,News Feed on desktop computers or News Feed on mobile devices,Unavailable,174.75,RUB,2015-06-23,41.5,MidAge,mid,mid,mid
356,such a beautiful day! such a beatiful view!,3.0,162.0,18 - 65+,06/09/15 05:57:56 AM PDT,https://www.facebook.com/pages/L-for-life/994910227187446,News Feed on desktop computers or News Feed on mobile devices,Unavailable,18.1,RUB,2015-06-09,41.5,MidAge,low,low,mid
357,"mckinney police officer involved in pool party incident        eric casebolt, the mckinney, police officer who was caught on video pinning a teenage girl to the ground and pulling his gun on others at a pool party, has resigned tuesday evening. the mckinney police department, chief of police greg conley said that casebolt's decision to leave was voluntary and that he would continue to collect a pension and benefits. why are the police so aggressive? it's in every state around the country. the young girl at the pool party was treated horrible. our society needs police, good police, people who will solve crimes but, unfortunately, today we need someone who will protect us from the police. at the same time, it is good that millions of regular people got a glimpse of what kind of policing minorities have endured for decades.",12.0,559.0,18 - 65+,06/10/15 07:31:35 AM PDT,https://www.facebook.com/Black-Matters-1579673598947501/,News Feed on desktop computers or News Feed on mobile devices,Unavailable,85.25,RUB,2015-06-10,41.5,MidAge,mid,mid,mid
358,"say it loud - ""i am black and i'm proud:""",45.0,635.0,18 - 65+,06/10/15 07:34:31 AM PDT,https://www.facebook.com/Black-Matters-1579673598947501/,News Feed on desktop computers or News Feed on mobile devices,Unavailable,94.04,RUB,2015-06-10,41.5,MidAge,mid,mid,mid
360,keeping eye on our brother's cases and much more,0.0,0.0,18 - 65+,06/10/15 03:01:20 AM PDT,https://www.facebook.com/blackmattersus,News Feed on desktop computers or News Feed on mobile devices,Unavailable,0.0,Unavailable,2015-06-10,41.5,MidAge,low,low,low
361,keeping eye on our brother's cases and much more,5.0,82.0,18 - 65+,06/10/15 03:20:43 AM PDT,https://www.facebook.com/blackmattersus/,News Feed on desktop computers or News Feed on mobile devices,Unavailable,34.66,RUB,2015-06-10,41.5,MidAge,mid,mid,low
363,keeping eye on our brother's cases and much more,0.0,0.0,18 - 65+,06/10/15 03:01:20 AM PDT,https://www.facebook.com/blackmattersus,News Feed on desktop computers or News Feed on mobile devices,Unavailable,0.0,Unavailable,2015-06-10,41.5,MidAge,low,low,low
364,keeping eye on our brother's cases and much more,2740.0,46447.0,18 - 65+,06/10/15 03:29:48 AM PDT,https://www.facebook.com/blackmattersus/,News Feed on desktop computers or News Feed on mobile devices,Unavailable,12858.46,RUB,2015-06-10,41.5,MidAge,high,high,high
366,keeping eye on our brother's cases and much more,0.0,158.0,18 - 65+,06/10/15 03:01:19 AM PDT,https://www.facebook.com/Black-Matters-1579673598947501/,News Feed on desktop computers or News Feed on mobile devices,Unavailable,50.11,RUB,2015-06-10,41.5,MidAge,mid,low,mid
368,join us because we care. black matters.,0.0,0.0,18 - 65+,06/10/15 02:59:59 AM PDT,https://www.facebook.com/blackmattersus,News Feed on desktop computers or News Feed on mobile devices,Unavailable,0.0,Unavailable,2015-06-10,41.5,MidAge,low,low,low
369,join us because we care. black matters.,3296.0,56408.0,18 - 65+,06/10/15 03:27:28 AM PDT,https://www.facebook.com/Black-Matters-1579673598947501/,News Feed on desktop computers or News Feed on mobile devices,Unavailable,13704.02,RUB,2015-06-10,41.5,MidAge,high,high,high
371,join us because we care. black matters.,0.0,0.0,18 - 65+,06/10/15 02:59:57 AM PDT,https://www.facebook.com/blackmattersus,News Feed on desktop computers or News Feed on mobile devices,Unavailable,0.0,Unavailable,2015-06-10,41.5,MidAge,low,low,low
372,join us because we care. black matters.,1574.0,26442.0,18 - 65+,06/10/15 03:30:17 AM PDT,https://www.facebook.com/Black-Matters-1579673598947501/,News Feed on desktop computers or News Feed on mobile devices,Unavailable,7018.96,RUB,2015-06-10,41.5,MidAge,high,high,high
376,your life matter.my life matter. black matters.,0.0,0.0,18 - 65+,06/10/15 02:58:57 AM PDT,https://www.facebook.com/blackmattersus,News Feed on desktop computers or News Feed on mobile devices,Unavailable,0.0,Unavailable,2015-06-10,41.5,MidAge,low,low,low
377,your life matter.my life matter. black matters.,7.0,249.0,18 - 65+,06/10/15 03:31:26 AM PDT,https://www.facebook.com/Black-Matters-1579673598947501/,News Feed on desktop computers or News Feed on mobile devices,Unavailable,85.63,RUB,2015-06-10,41.5,MidAge,mid,mid,mid
379,your life matter.my life matter. black matters.,0.0,0.0,18 - 65+,06/10/15 02:58:56 AM PDT,https://www.facebook.com/blackmattersus,News Feed on desktop computers or News Feed on mobile devices,Unavailable,0.0,Unavailable,2015-06-10,41.5,MidAge,low,low,low
380,your life matter.my life matter. black matters.,7.0,207.0,18 - 65+,06/10/15 03:30:43 AM PDT,https://www.facebook.com/Black-Matters-1579673598947501/,News Feed on desktop computers or News Feed on mobile devices,Unavailable,69.56,RUB,2015-06-10,41.5,MidAge,mid,mid,mid
382,your life matter.my life matter. black matters.,2.0,157.0,18 - 65+,06/10/15 02:58:54 AM PDT,https://www.facebook.com/Black-Matters-1579673598947501/,News Feed on desktop computers or News Feed on mobile devices,Unavailable,50.16,RUB,2015-06-10,41.5,MidAge,mid,low,mid
384,we really can change the world if we stay united.,0.0,0.0,18 - 65+,06/10/15 02:58:20 AM PDT,https://www.facebook.com/blackmattersus,News Feed on desktop computers or News Feed on mobile devices,Unavailable,0.0,Unavailable,2015-06-10,41.5,MidAge,low,low,low
385,we really can change the world if we stay united.,3.0,66.0,18 - 65+,06/10/15 03:28:34 AM PDT,https://www.facebook.com/Black-Matters-1579673598947501/,News Feed on desktop computers or News Feed on mobile devices,Unavailable,25.87,RUB,2015-06-10,41.5,MidAge,mid,low,low
387,we really can change the world if we stay united.,0.0,0.0,18 - 65+,06/10/15 02:58:20 AM PDT,https://www.facebook.com/blackmattersus,News Feed on desktop computers or News Feed on mobile devices,Unavailable,0.0,Unavailable,2015-06-10,41.5,MidAge,low,low,low
388,we really can change the world if we stay united.,8.0,311.0,18 - 65+,06/10/15 03:21:09 AM PDT,https://www.facebook.com/Black-Matters-1579673598947501/,News Feed on desktop computers or News Feed on mobile devices,Unavailable,105.62,RUB,2015-06-10,41.5,MidAge,mid,mid,mid
390,we really can change the world if we stay united.,4.0,204.0,18 - 65+,06/10/15 02:58:18 AM PDT,https://www.facebook.com/Black-Matters-1579673598947501/,News Feed on desktop computers or News Feed on mobile devices,Unavailable,65.61,RUB,2015-06-10,41.5,MidAge,mid,mid,mid
392,black matters because everyone's life matters,0.0,0.0,18 - 65+,06/10/15 02:58:03 AM PDT,https://www.facebook.com/blackmattersus,News Feed on desktop computers or News Feed on mobile devices,Unavailable,0.0,Unavailable,2015-06-10,41.5,MidAge,low,low,low
393,black matters because everyone's life matters,2.0,191.0,18 - 65+,06/10/15 03:22:04 AM PDT,https://www.facebook.com/Black-Matters-1579673598947501/,News Feed on desktop computers or News Feed on mobile devices,Unavailable,56.53,RUB,2015-06-10,41.5,MidAge,mid,low,mid
395,black matters because everyone's life matters,0.0,0.0,18 - 65+,06/10/15 02:58:01 AM PDT,https://www.facebook.com/blackmattersus,News Feed on desktop computers or News Feed on mobile devices,Unavailable,0.0,Unavailable,2015-06-10,41.5,MidAge,low,low,low
396,black matters because everyone's life matters,7.0,250.0,18 - 65+,06/10/15 03:27:56 AM PDT,https://www.facebook.com/Black-Matters-1579673598947501/,News Feed on desktop computers or News Feed on mobile devices,Unavailable,83.22,RUB,2015-06-10,41.5,MidAge,mid,mid,mid
398,black matters because everyone's life matters,1.0,136.0,18 - 65+,06/10/15 02:58:00 AM PDT,https://www.facebook.com/Black-Matters-1579673598947501/,News Feed on desktop computers or News Feed on mobile devices,Unavailable,38.89,RUB,2015-06-10,41.5,MidAge,mid,low,mid
400,we can be heard only when we stand together. black matters.,0.0,0.0,18 - 65+,06/10/15 02:57:12 AM PDT,https://www.facebook.com/blackmattersus,News Feed on desktop computers or News Feed on mobile devices,Unavailable,0.0,Unavailable,2015-06-10,41.5,MidAge,low,low,low
401,we can be heard only when we stand together. black matters.,4.0,203.0,18 - 65+,06/10/15 03:26:57 AM PDT,https://www.facebook.com/Black-Matters-1579673598947501/,News Feed on desktop computers or News Feed on mobile devices,Unavailable,74.07,RUB,2015-06-10,41.5,MidAge,mid,mid,mid
403,we can be heard only when we stand together. black matters.,0.0,0.0,18 - 65+,06/10/15 02:57:12 AM PDT,https://www.facebook.com/blackmattersus,News Feed on desktop computers or News Feed on mobile devices,Unavailable,0.0,Unavailable,2015-06-10,41.5,MidAge,low,low,low
404,we can be heard only when we stand together. black matters.,6.0,248.0,18 - 65+,06/10/15 03:21:36 AM PDT,https://www.facebook.com/Black-Matters-1579673598947501/,News Feed on desktop computers or News Feed on mobile devices,Unavailable,77.74,RUB,2015-06-10,41.5,MidAge,mid,mid,mid
406,we can be heard only when we stand together. black matters.,1.0,160.0,18 - 65+,06/10/15 02:57:10 AM PDT,https://www.facebook.com/Black-Matters-1579673598947501/,News Feed on desktop computers or News Feed on mobile devices,Unavailable,45.72,RUB,2015-06-10,41.5,MidAge,mid,low,mid
408,"african-american soldiers played a decisive role in the us army on the western frontier during the plains wars, but it's not mentioned in our history books.",60.0,636.0,18 - 65+,06/24/15 06:12:24 AM PDT,https://www.facebook.com/Black-Matters-1579673598947501/,News Feed on desktop computers or News Feed on mobile devices,Unavailable,189.05,RUB,2015-06-24,41.5,MidAge,mid,mid,mid
409,"cornel west on obama: ""the first black president has become the first niggerized black president""        reacting to president obama's use of the n-word on marc maron's podcast, cornel west called him the first ""niggerized"" president in an appearance on cnn. west criticized obama as ""a person who is afraid and intimidated when it comes to putting a spotlight on white supremacy."" ""a niggerized black person is a black person who is afraid and scared and intimidated when it comes to putting a spotlight on white supremacy and fighting against white supremacy,"" west explained. ""so when many of us said we have to fight against racism, what were we told? 'no, he can't deal with racism because he has other issues, political calculations. he's the president of all america, not just black america.' we know he's president of all america but white supremacy is american as cherry pie."" west is right as usual. african minorities would choose mr. west in 2009 and 2012 instead of obama. but we had no choice. cornel is a good leader, he knows what black community is suffering from. obama was promoted by big corporations owned by white people. obama never tried to protect blacks from police pressure, never tried to stop police violence against blacks. just count how many black lives were destroyed during his presidency. the number is horrific.",0.0,0.0,18 - 65+,06/24/15 06:03:43 AM PDT,https://www.facebook.com/Black-Matters-1579673598947501/,News Feed on desktop computers or News Feed on mobile devices,Unavailable,0.0,Unavailable,2015-06-24,41.5,MidAge,low,low,low
410,"autopsy says freddie gray died after sustaining 'high-energy injury' in police van        the baltimore state medical examiner's office has found that freddie gray likely died from a single ""high-energy injury"" sustained as he rode shackled in the back of a police van on the day of his arrest, according to an autopsy report obtained by the baltimore sun. the autopsy report suggested that gray may have attempted to stand up during the van ride, and that the injury could have occurred as he was thrown against the van wall when the vehicle changed direction. like really? when police took gray to the hospital, doctors determined that he had sustained a severed spine and crushed voice box. high-energy injury? we don't think so. it's hard to believe. do they think we're idiots or something? cops imprison you, shoot you, sever your spine, crush your larynx, send you to war, keep you poor, call you a thug and get away with it. there's no excuse for what happened to freddie.",12.0,71.0,18 - 65+,06/24/15 06:53:54 AM PDT,https://www.facebook.com/Black-Matters-1579673598947501/,News Feed on desktop computers or News Feed on mobile devices,Unavailable,22.75,RUB,2015-06-24,41.5,MidAge,mid,mid,low
411,"ella baker. the woman behind the scenes. not many of you will probably be able to recognize ella baker, who was a hero of the civil rights freedom movement, racial and economic injustice for five decades. her job was to put together the pieces in order to create a strong organization in the face of racism and injustice. she played a key role in naacp; student nonviolent coordinating committee and martin luther king's southern christian leadership conference.",42.0,332.0,18 - 65+,06/25/15 08:10:53 AM PDT,https://www.facebook.com/Black-Matters-1579673598947501/,News Feed on desktop computers or News Feed on mobile devices,Unavailable,81.49,RUB,2015-06-25,41.5,MidAge,mid,mid,mid
412,black matters,12.0,215.0,18 - 65+,06/25/15 08:10:19 AM PDT,https://www.facebook.com/Black-Matters-1579673598947501/,News Feed on desktop computers or News Feed on mobile devices,Unavailable,79.57,RUB,2015-06-25,41.5,MidAge,mid,mid,mid
422,"philosophy of african-american activist huey newton        huey newton was an african-american political activist and a leader of generation of black, best known for founding the militant black panther party in 1966. as a child, newton experienced racial discrimination that influenced him to create the black panther party as a voice of black people. his party grew up to a size of 5,000 full time party workers in 45 branches across america and inspired generation in north america to join the struggle against oppression. but he was shot to death in august 1989.",73.0,733.0,18 - 65+,06/23/15 07:43:14 AM PDT,https://www.facebook.com/Black-Matters-1579673598947501/,News Feed on desktop computers or News Feed on mobile devices,Unavailable,173.41,RUB,2015-06-23,41.5,MidAge,mid,mid,mid
423,"more riots are coming this summer ... unless what is the most important thing the government must to do this year in order our country to live in peace? the criminal justice system is very important institution where law enforcement investigate a crime gathering evidences to identify the presumed perpetrator ensuring that rights of the convicted are respected. but what if american criminal justice reform outdated and the country need to focus on a renewed sense of justice? what if disproportionate punishment is the main challenge of the criminal justice system? disproportionate punishments known far and wide across the united states of america. consequently, the victim's skin color plays a crucial role in deciding what kind of punishment he will receive. for instance, you are more likely to be sentenced to death if you have killed a white person. frankly speaking, if the government wants to keep the country away from the summer urban riots, then they must think about the living standards of black population that is several times below the living standards of white people in america. in addition, the white house must reduce the unemployment rates of black population by revising the hiring policy for black americans. therefore, if we want a life's balance, the government have to reconsider all these things, because black americans lives matter.",83.0,1012.0,18 - 65+,06/23/15 07:43:35 AM PDT,https://www.facebook.com/Black-Matters-1579673598947501/,News Feed on desktop computers or News Feed on mobile devices,Unavailable,261.08,RUB,2015-06-23,41.5,MidAge,mid,mid,mid
424,"fifty years ago, 48% of african american adults and 57% of african american children lived in poverty. today, only 28% of african american adults and 38% of african american children live in poverty. we've come so far, but still there is a long way to go.",0.0,0.0,18 - 65+,06/24/15 12:15:01 AM PDT,https://\vww.facebook.com/Black-Matters-1579673598947501/,News Feed on desktop computers or News Feed on mobile devices,Unavailable,0.0,Unavailable,2015-06-24,41.5,MidAge,low,low,low
425,7-year-old madeleine from charleston drew this picture in order to show us that being colorblind is awesome and we should give it a try.,72.0,755.0,18 - 65+,06/23/15 07:43:51 AM PDT,https://www.facebook.com/Black-Matters-1579673598947501/,News Feed on desktop computers or News Feed on mobile devices,Unavailable,173.57,RUB,2015-06-23,41.5,MidAge,mid,mid,mid
429,"sadness and shocking tragedy at historically black church in charlestone        a white gunman opened a fire at pastor and 8 other church members at black church in charlestone, s.0 on wednesday night. the young clean-shaved shooter walked in during a prayer meeting and started shooting the people. charleston police chief greg mullen said that the incident would be investigated as hate crime. emanuel ame church is a historically africa-american church which was found by denmark vesey in order to organize a slave revolt in 1822. despite the first black american president, africa-americans remain the most common victims of hate crimes. but what if the hate crime relates to xenophobia? american xenophobia is based on the dominant white heritage that is giving birth to another form of hate and discrimination. these forms take another level of hate. unfortunately, american tolerance is not what we think it is. us public is swapping patriotism for nationalism, tolerance for islamophobia, racism and anti-immigrant sentiment. for instance, last february american gunman killed three young muslims two miles away from the university of north carolina campus. was this gunman motivated by hate and intolerance? should we expect for more hate-crimes? what if american racial change still occurs through generations? what of it racism happens due to unequal opportunities? what if america is still a deeply racist country? what if the church is not a safe place anymore?",0.0,0.0,18 - 65+,06/18/15 02:49:23 AM PDT,https://www.facebook.com/Black-Matters-1579673598947501/,News Feed on desktop computers or News Feed on mobile devices,Unavailable,0.0,Unavailable,2015-06-18,41.5,MidAge,low,low,low
438,patriotism comes from your heart... follow its dictates and don't live a false life. join!,39.0,815.0,18 - 65+,06/23/15 07:09:49 AM PDT,https://www.facebook.com/patriototus,News Feed on desktop computers or News Feed on mobile devices,Right Wing,798.92,RUB,2015-06-23,41.5,MidAge,high,mid,mid
447,"we can't all be presidents, but we can all be patriots. join us!",0.0,0.0,18 - 65+,06/23/15 07:08:59 AM PDT,https://www.facebook.com/patriototus,News Feed on desktop computers or News Feed on mobile devices,Right Wing,0.0,Unavailable,2015-06-23,41.5,MidAge,low,low,low
450,united we stand! welcome every patriot we can reach. flag and news!,72043.0,529205.0,18 - 65+,06/23/15 12:41:02 AM PDT,https://www.facebook.com/patriototus/,News Feed on desktop computers or News Feed on mobile devices,Right Wing,331675.75,RUB,2015-06-23,41.5,MidAge,high,high,high
453,"we can't all be presidents, but we can all be patriots. join us!",0.0,0.0,18 - 65+,06/23/15 07:08:58 AM PDT,https://www.facebook.com/patriototus,News Feed on desktop computers or News Feed on mobile devices,Right Wing,0.0,Unavailable,2015-06-23,41.5,MidAge,low,low,low
481,patriotism begins at home. join new community about homeland!,0.0,0.0,18 - 65+,06/23/15 07:10:47 AM PDT,https://www.facebook.com/patriototus,News Feed on desktop computers or News Feed on mobile devices,Right Wing,0.0,Unavailable,2015-06-23,41.5,MidAge,low,low,low
484,patriotism comes from your heart... follow its dictates and don't live a false life. join!,0.0,0.0,18 - 65+,06/23/15 07:09:49 AM PDT,https://www.facebook.com/patriototus,News Feed on desktop computers or News Feed on mobile devices,Right Wing,0.0,Unavailable,2015-06-23,41.5,MidAge,low,low,low
504,patriotism begins at home. join new community about homeland!,0.0,0.0,18 - 65+,06/23/15 07:10:47 AM PDT,https://www.facebook.com/patriototus,News Feed on desktop computers or News Feed on mobile devices,Right Wing,0.0,Unavailable,2015-06-23,41.5,MidAge,low,low,low
505,your freedom starts here. join!,59.0,742.0,18 - 65+,06/23/15 07:10:04 AM PDT,https://www.facebook.com/patriototus,News Feed on desktop computers or News Feed on mobile devices,Right Wing,434.53,RUB,2015-06-23,41.5,MidAge,high,mid,mid
520,your freedom starts here. join!,0.0,0.0,18 - 65+,06/23/15 07:10:04 AM PDT,https://www.facebook.com/patriototus,News Feed on desktop computers or News Feed on mobile devices,Right Wing,0.0,Unavailable,2015-06-23,41.5,MidAge,low,low,low
551,"republican strategist karl rove said on ""fox news sunday"" the only way to stop gun-related violence, like the wednesday massacre at emmanuel african methodist church in charleston s.c., was to repeal american citizens' second amendment rights. it's strange to hear it from the man who supported 2nd amendment earlier. the lack of clear-cut opinion is very bad character trait. however, it doesn't matter. the right to bear arms is inalienable right of americans that was given us by the founding fathers. the 2nd amendment guarantees private safety of the people. the right to keep and bear arms has been recognized as existing prior even to the creation of a written national constitution. the govermmnet should respect the 2nd amendment and the law in general. it's pity when some politicians think otherwise. people should understand that a gun is not a killing tool, it's self-defense tool. and we will stand for our right to keep and bear arms!",0.0,0.0,18 - 65+,06/23/15 07:13:22 AM PDT,https://www.facebook.com/patriototus,News Feed on desktop computers or News Feed on mobile devices,Right Wing,0.0,Unavailable,2015-06-23,41.5,MidAge,low,low,low
552,"the chinese hackers executed a complex attack that gave them ""administrator privileges"" into the computer networks at the office of personnel management, mimicking the credentials of people who run the agency's systems. they began siphoning out a rush of data after constructing what amounted to an electronic pipeline that led back to china, investigators told congress last week in classified briefings.        much of the personnel data had been stored in the lightly protected systems of the department of the interior, because it had cheap, available space for digital data storage. the administration is urgently working to determine what other agencies are storing similarly sensitive information with weak protections. officials would not identify their top concerns, but an audit issued early last year, before the chinese attacks, harshly criticized lax security at the internal revenue service, the nuclear regulatory commission, the energy department, the securities and exchange commission — and the department of homeland security, which has responsibility for securing the nation's critical networks. it's not clear who is held liable for security hole. what do you think the hacker attack will affect u.s. — chinese relations?",0.0,0.0,18 - 65+,06/23/15 07:14:41 AM PDT,https://www.facebook.com/patriototus,News Feed on desktop computers or News Feed on mobile devices,Right Wing,0.0,Unavailable,2015-06-23,41.5,MidAge,low,low,low
553,"the battle of okinawa, codenamed operation iceberg, came to the end on june 22, 1945. the operation was fought on the ryukyu islands of okinawa and included the largest amphibious assault in the pacific war during world war ii. the military value of okinawa ""exceeded all hope."" okinawa provided a fleet anchorage, troop staging areas, and airfields in close proximity to japan.",0.0,0.0,18 - 65+,06/23/15 07:37:18 AM PDT,https://www.facebook.com/patriototus,News Feed on desktop computers or News Feed on mobile devices,Right Wing,0.0,Unavailable,2015-06-23,41.5,MidAge,low,low,low
554,"since the game of american football was first played at the collegiate level in the late 1860s, the sport has captivated fans by using both strength and strategy to get the win. with the introduction of the american professional football association, later renamed to the national football league, audiences saw athletes play more ferociously than ever before. american football has actually became national kind of sports in the united states. we are proud of such players as michael vick, peyton manning and john elway. we are proud we live in america!",0.0,0.0,18 - 65+,06/23/15 07:13:53 AM PDT,https://www.facebook.com/patriototus,News Feed on desktop computers or News Feed on mobile devices,Right Wing,0.0,Unavailable,2015-06-23,41.5,MidAge,low,low,low
555,"it is a symbol of patriots who were willing to die in order to protect this country and to make sure it has remained as the founders intended. south carolina governor calls for removal of confederate flag from statehousegovernor nikki haley makes abrupt about-face in wake of charleston killings to call for removal of flag that has flown on statehouse grounds for 50 years the confederate flag represents heritage, not hate. the war that is called the ""civil war"" was actually the ""war for southern independence"". this is our history and our heritage. just because certain groups have used the confederate flag in hate related crimes or racism does not make the southern flag racist. now it is used to show heritage and pride from the south showing that they have been strong and have overcome what has happened to them over time.",0.0,0.0,18 - 65+,06/23/15 08:23:32 AM PDT,https://www.facebook.com/patriototus,News Feed on desktop computers or News Feed on mobile devices,Right Wing,0.0,Unavailable,2015-06-23,41.5,MidAge,low,low,low
556,"why do immigrants think that the u.s. government should create good conditions for them? i think immigrants should prove that they are deserved to stay in the united states. why should we give a citizenship to those who cannot give something good for the nation? the worst thing is that illegal immigrants who broke the law to live in the united states demand ask for indulgences. what nonsense! illegals should be deported from the country invariably. but obama's administration is tied to the chariot of immigrants. democrats know that immigrants will vote for the democratic party. especially former illegals. that's why barack obama tries to give the immigration amnesty to illegals as soon as possible. it will allow to increase a number of votes for a democratic party presidential candidate in 2016. and democrats don't care about the fact that most of immigrants will become welfare recipients, increasing unemployment rate. america doesn't need immigrants, democrats do. what's more important: to win presidential elections in 2016 or to make america better? democrats seem to choose first option. that's what differs republicans from democrats.",0.0,0.0,18 - 65+,06/23/15 07:37:02 AM PDT,https://www.facebook.com/patriototus,News Feed on desktop computers or News Feed on mobile devices,Right Wing,0.0,Unavailable,2015-06-23,41.5,MidAge,low,low,low
557,our flag is one with colors every so bright a symbol of goodwill and all that's right it is a beacon for those who are oppressed who pine to live in the land of the blessed the photo of the apollo 15 space shuttle on the moon is historic moment in the history of the world. this was the first time that a man stepped foot on the moon.,0.0,0.0,18 - 65+,06/23/15 07:13:03 AM PDT,https://www.facebook.com/patriototus,News Feed on desktop computers or News Feed on mobile devices,Right Wing,0.0,Unavailable,2015-06-23,41.5,MidAge,low,low,low
580,we speak for all fellow members of lgbt community across the nation.,103.0,122.0,18 - 65+,06/16/15 03:36:10 AM PDT,https://www.facebook.com/Igbtun/,News Feed on desktop computers or News Feed on mobile devices,Left Wing,129.66,RUB,2015-06-16,41.5,MidAge,mid,mid,mid
581,we speak for all fellow members of lgbt community across the nation.,36.0,1438.0,18 - 65+,06/17/15 03:15:18 AM PDT,https://www.facebook.com/Igbtun/,News Feed on desktop computers or News Feed on mobile devices,Left Wing,1362.57,RUB,2015-06-17,41.5,MidAge,high,mid,mid
582,we speak for all fellow members of lgbt community across the nation.,1724.0,18891.0,18 - 65+,06/18/15 12:58:48 AM PDT,https://www.facebook.com/Igbtun/,News Feed on desktop computers or News Feed on mobile devices,Left Wing,10085.77,RUB,2015-06-18,41.5,MidAge,high,high,high
583,we speak for all fellow members of lgbt community across the nation.,186.0,4265.0,18 - 65+,06/22/15 08:19:07 AM PDT,https://www.facebook.com/Igbtun/,News Feed on desktop computers or News Feed on mobile devices,Left Wing,1393.55,RUB,2015-06-22,41.5,MidAge,high,mid,mid
584,we speak for all fellow members of lgbt community across the nation.,3206.0,31618.0,18 - 65+,06/23/15 05:06:57 AM PDT,https://www.facebook.com/Igbtun/,News Feed on desktop computers or News Feed on mobile devices,Left Wing,16630.2,RUB,2015-06-23,41.5,MidAge,high,high,high
653,"the colorful activism of new york's most radical queers these wonderful people creating a powerful community through progressive politics, community gardens, wild parties, and colorful performance. call them the radical queers, and know that the term is flexible; and evolving. from the local gardens of the east village to bushwick warehouses; a new wave of new york artists; thinkers and activists young and old. they are banding together to question and redefine what it means to be queer today. it's beauty; perfection; freedom, and of course lots and lots of love! #igbtq #queer #nyc #art #glamour #perfection",25.0,633.0,18 - 65+,06/23/15 07:03:29 AM PDT,https://www.facebook.com/LGBT-United-839497472793277/,News Feed on desktop computers or News Feed on mobile devices,Unavailable,179.89,RUB,2015-06-23,41.5,MidAge,mid,mid,mid
654,"nom's last attempt to ban same sex marriage national organization for marriage is asking all of the gop presidential candidates to sign an anti-equality pledge. let's take a look at just how crazy this pledge gets.       that's just nuts! they want candidates to support a constitutional amendment to ban marriage nationwide. this will never happen. for the last decade public support for marriage equality has gone from 35 percent to 55 percent! but they don't stop there. nom also wants candidates to ""work to overturn any supreme court decision"" in favor of the freedom to marry. nom wants the president to only nominate judges who will uphold marriage bans, but at this point, legal consensus so strongly supports marriage equality that supporting marriage bans is a sign that person isn't qualified to be a judge. also, nom wants the candidates to weaken civil rights laws, creating loopholes to let companies and citizens to discriminate if they cite a religious justification. that could actually happen — and it already has in some states — so it's a huge concern. and fifth, they want the department of justice to investigate harassment against people who oppose marriage equality. sure, gays and lesbians are harassed every day, fired, kicked out of their homes and schools, separated from their families, but i really hope soon there'll be no more of it! there's a part of me that feels very sad for nom's fanatics. when they finally kick the bucket, they'll be dealing with the reality (whether they openly face it or not) that their life's work has amounted to nothing. nothing they worked for made anyone's life better. at all. they didn't win, and they wasted their lives fighting against the inevitable. and when they're dead and gone, they'll be remembered only as footnotes in shameful history — or more likely they'll be forgotten completely. #lgbt #nom #samesexmarriage #marriage #scotus #equality",49.0,691.0,18 - 65+,06/23/15 07:03:47 AM PDT,https://www.facebook.com/LGBT-United-839497472793277/,News Feed on desktop computers or News Feed on mobile devices,Unavailable,183.93,RUB,2015-06-23,41.5,MidAge,mid,mid,mid
656,"ruby rose sharing thoughts about gender fluidity. ruby rose has long been the celebrity crush of lesbians the world over. but now that she's a star in 'orange is the new black', the popularity of this model, actress, and vj has grown worldwide.        ""gender fluidity is not really feeling like you're at one end of the spectrum or the other. for the most part, i definitely don't identify as any gender,"" - rose said; - ""i'm not a guy; i don't really feel like a woman, but obviously i was born one. as a little kid, i was convinced that i was a guy. then in my teens, i tried to be quite feminine ... and after a little bit, chopped everything off and am kind of back where i started. so, i'm somewhere in the middle, which - in my perfect imagination - is like having the best of both sexes."" #igbt #rubyrose #genderfluidity #lesbian #orangelsthenewblack",150.0,1484.0,18 - 65+,06/23/15 07:04:59 AM PDT,https://www.facebook.com/LGBT-United-839497472793277/,News Feed on desktop computers or News Feed on mobile devices,Unavailable,368.34,RUB,2015-06-23,41.5,MidAge,high,mid,mid
657,"pete buttigieg is south bend's 32nd mayor and america's youngest mayor of a city of over 100,000 residents. recently buttigieg came out publicly as gay. in life and in service, people like pete is an inspiration for us all!        #igbt #queerquote #uspolitics #indiana #comingout #buttigieg",1.0,30.0,18 - 65+,06/23/15 07:04:39 AM PDT,https://www.facebook.com/LGBT-United-839497472793277/,News Feed on desktop computers or News Feed on mobile devices,Unavailable,9.15,RUB,2015-06-23,41.5,MidAge,low,low,low
658,"the ninth transgender was found death in the usa transgender teen mercedes williamson was found dead in a wooded area. she is the ninth confirmed transgender homicide victim in the usa this year. police in george county. mississippi have charged a suspect josh brandon vallum. police said that mercedes and josh knew each other, but it is not clear if vallum knew williamson was a transgender. jeanie miller, whom williamson had been living with, said that vallum knew that williamson was transgender. modern america is too dangerous for transgenders. this is the ninth transgender killing based on gender identity. according to the national coalition of anti-violence programs' report hate-motivated violence against transgenders rose 13%. unfortunately, it is very difficult to live as a transgender in the south. alabama even passed a religious freedom law in 1998 that allows discrimination against lgbt people. that also allows lawmakers to justify hostility toward transgender people. and that we call `freedom'? america is no longer land of freedom!",80.0,791.0,18 - 65+,06/23/15 07:33:17 AM PDT,https://www.facebook.com/LGBT-United-839497472793277/,News Feed on desktop computers or News Feed on mobile devices,Unavailable,181.49,RUB,2015-06-23,41.5,MidAge,mid,mid,mid
659,"matt cage comes out as gay       the pro wrestler matt cage, known as 'money' publicly announced that he is gay in a facebook post. previously matt hullum identified himself as bisexual. sorry, ladies. i'm officially pulling myself off of the market. don't hate me too bad.' 'i truly have nothing to hide anymore,' he wrote. 'i spent the majority of my life lying, hiding and depressed because i felt like i couldn't truly be who i wanted to be and live freely as i saw fit. i had to act and that's not me. i, nor anyone else, should have to do that.' matt decided to tell the truth publicly because of speculation that was going behind his back. this news should please all progressive humanity because the coming-out once again confirms the fact that homosexuality and masculinity are a perfect combination and do not contradict each other.",0.0,0.0,18 - 65+,06/24/15 07:15:12 AM PDT,https://www.facebook.com/LGBT-United-839497472793277/,News Feed on desktop computers or News Feed on mobile devices,Unavailable,0.0,Unavailable,2015-06-24,41.5,MidAge,low,low,low
660,"first lgbt studies course opens in a san francisco high school a san francisco high school may be the first us school to offer an lgbt studies course. the course will teach terminology and the history of lgbt movement. ""we'll look at what it's been like for gay men, what it's been like for lesbian women, what it's been like for transgender people,"" ruth asawa high school social studies teacher lyndsey schlax told. schlax has been working with cleve jones, a human rights activist, who was mentored by harvey milk. it is proposed that the class will begin in autumn. really perfect idea! there are at least twenty eight percent of lgbt students in asawa high school. it is the fact that we need such classes in every american school! children shouldn't be afraid to show who they are; they shouldn't be afraid to speak about lgbt history; they should know that it is normal to be gay or lesbian or transgender. everybody should be taught to understand lgbt people and recognize them as ordinary citizens.",3.0,118.0,18 - 65+,06/24/15 07:15:44 AM PDT,https://www.facebook.com/LGBT-United-839497472793277/,News Feed on desktop computers or News Feed on mobile devices,Unavailable,42.94,RUB,2015-06-24,41.5,MidAge,mid,low,mid
661,"good morning, dear friends! have a tasty and colorful morning! all you need is love, coffee and rainbow dishes!",12.0,102.0,18 - 65+,06/24/15 07:16:43 AM PDT,https://www.facebook.com/LGBT-United-839497472793277/,News Feed on desktop computers or News Feed on mobile devices,Unavailable,53.13,RUB,2015-06-24,41.5,MidAge,mid,mid,mid
662,silent no more: we deserve equal rights! this photo of gay rights protest was made in new york in 1971. these are early days in the fight for gay rights.,61.0,920.0,18 - 65+,06/25/15 04:16:59 AM PDT,https://www.facebook.com/LGBT-United-839497472793277/,News Feed on desktop computers or News Feed on mobile devices,Unavailable,400.0,RUB,2015-06-25,41.5,MidAge,high,mid,mid
663,"california attorney general ruled against the execution of gays and lesbians        a california judge argued against a proposed initiative about the execution of gay and lesbian people, naming this measure ""unconstitutional on its face."" the sodomite suppression act proposes that ""any person who willingly touches another person of the same gender for purposes of sexual gratification be put to death by bullets to the head or by any other convenient method."" the act also will outlaw advocating gay rights to minors. california attorney general kamala harris claimed that the proposal was unconstitutional and it had no place in civil society. the proposal reminds me the inquisition. we live in a free and tolerate country! so even talks about such an initiative should be immediately stopped. where is our president? stop considering gays as naughty and not like all the others. we are all equal. despite all the arguments that the opponents of gay marriage call, polls show that the majority of americans stand for gay marriages. why not to hold a referendum as the irish did? why we should listen to conservatives?",74.0,1038.0,18 - 65+,06/25/15 04:17:19 AM PDT,https://www.facebook.com/LGBT-United-839497472793277/,News Feed on desktop computers or News Feed on mobile devices,Unavailable,400.0,RUB,2015-06-25,41.5,MidAge,high,mid,mid
665,"""gay, lesbian, bi, and straight, we are the community and family of god, and we are here knowing god loves us."" -rev. nathan baxter        #igbtq #together #community #gay #lesbian #transgender #natanbaxter",37.0,365.0,18 - 65+,06/23/15 07:03:13 AM PDT,https://www.facebook.com/LGBT-United-839497472793277/,News Feed on desktop computers or News Feed on mobile devices,Unavailable,91.81,RUB,2015-06-23,41.5,MidAge,mid,mid,mid
666,"transgender employees will get health coverage        on tuesday the federal government ordered health insurers to include transition-related health coverage for transgender employees in their plans. ""effective january 1, 2016, no carrier participating in the federal employees health benefits program may have a general exclusion of services, drugs or supplies related to gender transition or ̀ sex transformations,""' the new ""carrier letter"" said. lgbt advocates who have been pressing the administration for change welcomed the news. ""with today's announcement, transgender federal employees can now access health care that is so fundamental to their well- being and, in the long-term, will make transgender employees happier and more productive workers,"" national center for transgender equality executive director mara keisling told. yeah, it is really happy news for transgender people! now the discrimination on coverage for trans people will be ended.",39.0,645.0,18 - 65+,06/25/15 04:26:40 AM PDT,https://www.facebook.com/LGBT-United-839497472793277/,News Feed on desktop computers or News Feed on mobile devices,Unavailable,269.87,RUB,2015-06-25,41.5,MidAge,mid,mid,mid
668,we speak for all fellow members of lgbt community across the nation.,0.0,0.0,18 - 65+,06/16/15 03:36:09 AM PDT,https://www.facebook.com/LGBT-United-839497472793277/,News Feed on desktop computers or News Feed on mobile devices,Left Wing,0.0,Unavailable,2015-06-16,41.5,MidAge,low,low,low
669,we speak for all fellow members of lgbt community across the nation.,91.0,1997.0,18 - 65+,06/17/15 03:15:18 AM PDT,https://www.facebook.com/LGBT-United-839497472793277/,News Feed on desktop computers or News Feed on mobile devices,Left Wing,2673.94,RUB,2015-06-17,41.5,MidAge,high,mid,mid
670,we speak for all fellow members of lgbt community across the nation.,0.0,0.0,18 - 65+,06/18/15 12:58:48 AM PDT,https://www.facebook.com/LGBT-United-839497472793277/,News Feed on desktop computers or News Feed on mobile devices,Left Wing,0.0,Unavailable,2015-06-18,41.5,MidAge,low,low,low
671,"new lgbt community. everyday news, updates, coming outs and much more!",0.0,0.0,18 - 65+,06/18/15 12:57:19 AM PDT,https://www.facebook.com/LGBT-United-839497472793277/,News Feed on desktop computers or News Feed on mobile devices,Left Wing,0.0,Unavailable,2015-06-18,41.5,MidAge,low,low,low
672,"new lgbt community. everyday news, updates, coming outs and much more!",12.0,115.0,18 - 65+,06/18/15 12:58:48 AM PDT,https://www.facebook.com/LGBT-United-839497472793277/,News Feed on desktop computers or News Feed on mobile devices,Left Wing,206.25,RUB,2015-06-18,41.5,MidAge,mid,mid,mid
673,we speak for all fellow members of lgbt community across the nation. gender preference does not define you. your spirit defines you.,0.0,0.0,18 - 65+,06/22/15 08:19:07 AM PDT,https://www.facebook.com/LGBT-United-839497472793277/,News Feed on desktop computers or News Feed on mobile devices,Left Wing,0.0,Unavailable,2015-06-22,41.5,MidAge,low,low,low
674,"everyday news, updates, coming outs and much more! united we stand!",0.0,0.0,18 - 65+,06/18/15 12:57:58 AM PDT,https://www.facebook.com/LGBT-United-839497472793277/,News Feed on desktop computers or News Feed on mobile devices,Left Wing,0.0,Unavailable,2015-06-18,41.5,MidAge,low,low,low
675,"everyday news, updates, coming outs and much more! united we stand!",4.0,59.0,18 - 65+,06/18/15 12:58:48 AM PDT,https://www.facebook.com/LGBT-United-839497472793277/,News Feed on desktop computers or News Feed on mobile devices,Left Wing,102.75,RUB,2015-06-18,41.5,MidAge,mid,mid,low
676,we speak for all fellow members of lgbt community across the nation. gender preference does not define you. your spirit defines you.,0.0,0.0,18 - 65+,06/22/15 08:19:07 AM PDT,https://www.facebook.com/LGBT-United-839497472793277/,News Feed on desktop computers or News Feed on mobile devices,Left Wing,0.0,Unavailable,2015-06-22,41.5,MidAge,low,low,low
3394,we speak for all fellow members of lgbt community across the nation. gender preference does not define you. your spirit defines you.,0.0,0.0,18 - 65+,06/22/15 08:19:07 AM PDT,https://www.facebook.com/LGBT-United-839497472793277/,News Feed on desktop computers or News Feed on mobile devices,Left Wing,0.0,Unavailable,2015-06-22,41.5,MidAge,low,low,low
418,"what's life of black american today? how equal are we? have you ever been hurt by aggressive police officers because of your race? what's your story?        take an action and tell us your story and we post it on ""black matters"". we don't want our community to continue struggling with racism and police aggression. we want to fight back and to show how strong we are. add your voice by sharing your experiences with us. you can send your story to blackmattersus@gmail.com or you can message us via facebook anonym. or not. being black in america comes with extra obstacles but together we call for powerful justice! tell your story!",0.0,0.0,18 - 65+,07/08/15 07:23:45 AM PDT,https://www.facebook.com/Black-Matters-1579673598947501/,News Feed on desktop computers or News Feed on mobile devices,Unavailable,0.0,Unavailable,2015-07-08,41.5,MidAge,low,low,low
491,"1 absolutely love this picture. i can't explain why, but just everything about it makes it kind of dusty in here....",52.0,635.0,18 - 65+,07/15/15 08:28:48 AM PDT,https://www.facebook.com/patriototus,News Feed on desktop computers or News Feed on mobile devices,Unavailable,80.79,RUB,2015-07-15,41.5,MidAge,mid,mid,mid
495,this cute babe is a fan of the patriots! what is your favorite nfl team?,41.0,975.0,18 - 65+,07/17/15 12:55:09 AM PDT,https://www.facebook.com/patriototus,News Feed on desktop computers or News Feed on mobile  devices,Unavailable,461.56,RUB,2015-07-17,41.5,MidAge,high,mid,mid
568,"excuse me ... what?!?  taxpayers spend $3.5 million to find out why lesbians are fat  a u.s. health and human services study to understand why lesbians are fat  has now cost taxpayers over $3.5 million to-date.  the study, ""sexual orientation and obesity: a test of a gendered  biopsychosocial model,"" seeks to determine why there is a disparity in the  obesity rates between straight women and lesbian women and straight men  and gay men.  oh god!! it made you look the fools! people overeat when they are unhappy  with themselves and their lives! not only lesbians! and we have enough  reasons! first of all - your research!!lt's humiliating!",67.0,467.0,18 - 65+,07/15/15 03:40:04 AM PDT,https://www.facebook.com/LGBT-United-839497472793277I,News Feed on desktop computers or News Feed on mobile  devices,Unavailable,116.59,RUB,2015-07-15,41.5,MidAge,mid,mid,mid
571,"congratulations! now we have the gay scouts of america!  the boy scouts of america executive committee unanimously approved  allowing gay adults to serve as leaders, officials said on monday, in a major  step toward dismantling a policy that has caused deep rifts in the 105-year-old  organization.  this resolution will allow chartered organizations to select adult leaders  without regard to sexual orientation, continuing scouting's longstanding  policy of chartered organizations selecting their leaders.  the boy scouts of america's ban on gay adults has stood as a towering  example of explicit, institutional homophobia in one of america's most  important and recognizable civic organizations.  this is a step in the right direction, but we're still really concerned that there  are still going to be groups that are going to be hostile to gay leaders ... this  story certainly brought out the haters and the loony ""christians."" they've lost  so many cultural battles in their effort to keep us all in the middle ages that i  think it's unhinged most of them!",30.0,280.0,18 - 65+,07/15/15 03:40:52 AM PDT,https://www.facebook.com/LGBT-United-839497472793277/,News Feed on desktop computers or News Feed on mobile  devices,Unavailable,120.29,RUB,2015-07-15,41.5,MidAge,mid,mid,mid
639,"soldier shane. recently pentagon confirmed plan to lift ban on transgender military service. let's meet the big player in repealing the ban.        sergeant shane ortega, 28, doesn't stand out or appear out of the ordinary among his fellow army soldiers. but there's one thing that differs him from the bulk of troops. shane is the first openly trans soldier of the us army. he's astonishingly handsome, he works out constantly (check out his muscular build), he covered in tattoos, he's part black, latino and cherokee, he's obsessed with his girlfriend (a former model and aspiring doctor); and he gets giddy talking about both video games and chopping wood in alaska. yet despite his solid performance and commitment to serve, sgt ortega has been at risk of getting kicked out of the army because in official army paperwork, he is identified as a woman. but the real warriors never surrender! ortega struggled for the equal rights for the transgender people in the military. and he succeeded! america's military progressing slowly towards inclusion and equal opportunity. let's hope that these changes'll ensure peace, instead of waging more war. #igbt #transgender #equality #usarmy #ortega",464.0,3274.0,18 - 65+,07/16/15 01:46:23 AM PDT,https://www.facebook.com/LGBT-United-839497472793277/,News Feed on desktop computers or News Feed on mobile devices,Unavailable,500.0,RUB,2015-07-16,41.5,MidAge,high,high,mid
640,"dykes on bikes birthday is in july!        dykes on bikes is a chartered lesbian motorcycle club with 22 chapters and numerous affiliations, founded back in 1976. they are known for their participation in gay pride events such as pride parades, and significant lgbt events like the international gay games. dykes on bikes have been leading marches such as gay pride parades, gay games events and protests. the dyke march events are generally non-commercial, often in sharp contrast to corporate-sponsored pride events, and are usually inclusive of lesbian, bi, and trans women. leading pride parades around the world from san francisco to melbourne, paris, london, tokyo, toronto, vancouver, sydney,zurich, tel aviv, you name it! #dykesonbikes #dob #lesbian #dyke #igbt #prideparade",91.0,865.0,18 - 65+,07/16/15 01:45:49 AM PDT,https://www.facebook.com/LGBT-United-839497472793277/,News Feed on desktop computers or News Feed on mobile devices,Unavailable,299.93,RUB,2015-07-16,41.5,MidAge,mid,mid,mid
643,"please ... stop discrimination against homosexual teachers!!  after eight years on the job, margie winters was fired as director of religious  education at waldron mercy academy outside philadelphia not because she  just married her wife, but because some parents just found out that she's  been married for all eight years.  unfortunately lgbt teachers have long understood that openly expressing  their identity in school can make them an easy target for discrimination. it is  the biggest mistake!  when students perceive that they're not supposed to talk about  homosexuality, they conclude that there must be something wrong about  being gay. and it's a dangerous message that can lead to bullying and  harassment.  gay teachers need to serve as example for kids! it's very powerful both for  straight students and for lgbt students to know that they have teachers and  people they respect who are lgbt and who are good at their jobs. it's  important for all students to see that nothing to be ashamed! and it must be  illegal for employers to discriminate against employees based on their actual  or perceived sexual orientation!",229.0,2109.0,18 - 65+,07/10/15 05:36:04 AM PDT,https://www.facebook.com/LGBT-United-839497472793277I,News Feed on desktop computers or News Feed on mobile  devices,Unavailable,600.0,RUB,2015-07-10,41.5,MidAge,high,mid,mid
644,when this triumphant yearbook entry was published,421.0,3359.0,18 - 65+,07/09/15 07:00:23 AM PDT,https://www.facebook.com/LGBT-United-839497472793277I,News Feed on desktop computers or News Feed on mobile  devices,Unavailable,500.0,RUB,2015-07-09,41.5,MidAge,high,high,mid
646,"this man is great example of human filth and lies!! rape children!?! really?!  are you nuts?!  louisiana justice refuses to obey supreme court, writes opinion implying  gay people rape their children  raising children and starting a family is something that all people look forward  to in life! we are just people, not criminals! and we love children, not  rape!! we are all equal! it is better for child to live with homosexual parents  then to live on the street or in orphanage! millions of children need love and  they don't care if our love is different. why should we let those children that  are left on the streets be on the streets when a warm and open home are  open to them?! i don't understand!!",156.0,1400.0,18 - 65+,07/10/15 05:35:23 AM PDT,https://www.facebook.com/LGBT-United-839497472793277I,News Feed on desktop computers or News Feed on mobile  devices,Unavailable,400.0,RUB,2015-07-10,41.5,MidAge,high,mid,mid
647,"the greatest legacy one can pass on to one's children and grandchildren is  not money or other material things accumulated in one's life, but rather a  legacy of character and faith.  love your children and have a good day!",47.0,520.0,18 - 65+,07/09/15 06:59:52 AM PDT,https://www.facebook.com/LGBT-United-839497472793277I,News Feed on desktop computers or News Feed on mobile  devices,Unavailable,153.89,RUB,2015-07-09,41.5,MidAge,mid,mid,mid
648,i wish all parents were like this,44.0,311.0,18 - 65+,07/08/15 07:26:12 AM PDT,https://www.facebook.com/LGBT-United-839497472793277I,News Feed on desktop computers or News Feed on mobile  devices,Unavailable,141.51,RUB,2015-07-08,41.5,MidAge,mid,mid,mid
649,"homophobic nurse tries to discourage birth mom from allowing gay couple to  adopt child  while the birth mother was resting with the baby, andy and his partner took a  break from the hospital to get some food. when they returned, they had a  flurry of phone messages from the mother, crying and urging them to get back  soon. a nurse had been questioning her about her decision to let a gay  couple adopt her baby.  ""aren't you afraid those boys are gonna hurt that baby? aren't you afraid  that he's not gonna grow up and be normal?"" asked the nurse.  excuse me who the hell is she?! this bigot is forcing her views onto the  mother, because she doesn't think the baby would grow up ""normal""? a  mother who's making the difficult decision to place her son up for adoption,  and a wonderful couple who wants to raise that child. what the hell right does  the nurse have to try to stop that? i hope they fire her.  i'm happy for the gay couple on becoming parents!",2042.0,6675.0,18 - 65+,07/10/15 06:14:07 AM PDT,https://www.facebook.com/LGBT-United-839497472793277I,News Feed on desktop computers or News Feed on mobile  devices,Unavailable,452.12,RUB,2015-07-10,41.5,MidAge,high,high,high
651,"nature chooses who will be transgender; individuals don't choose this  we received a letter ... the history of life ...  «hello! just wanted to see if you could share my coming out as trans story on  your page. i have been on a long, rough journey to this point and i think my  story could help younger trans youth see that no matter how bad it gets it  always gets better. i would really appreciate this because i want to become  someone who inspires the lgbt community to be themselves!  ever since i was little, i knew i was different. i wasn't like any of the other  kids. i had a unique way of thinking and often that left me isolated. something  i still feel the sting of today. unlike most boys who played with spiderman and  superman action figures when they were little, i played with barbies ... i  wanted to look like them. i wanted to be them. it felt right playing with these  dolls. i had to hide when i did it though because even at an early age, i knew  boys weren't supposed to play with dolls. once i had gotten got caught by  my grandmother's ex husband and he told me to put them away and stop  being a sissy .... ""  please spend 5 minutes to read this letter ... it is very important just to be  heart ...  thank you for your brave act! you are a true hero!  please share your stories and photos .... inspire us and others!",0.0,0.0,18 - 65+,07/10/15 05:35:43 AM PDT,https://www.facebook.com/LGBT-United-839497472793277I,News Feed on desktop computers or News Feed on mobile  devices,Unavailable,0.0,Unavailable,2015-07-10,41.5,MidAge,low,low,low
652,"homophobic nurse tries to discourage birth mom from allowing gay couple to  adopt child  while the birth mother was resting with the baby, andy and his partner took a  break from the hospital to get some food. when they returned, they had a  flurry of phone messages from the mother, crying and urging them to get back  soon. a nurse had been questioning her about her decision to let a gay  couple adopt her baby.  ""aren't you afraid those boys are gonna hurt that baby? aren't you afraid  that he's not gonna grow up and be normal?"" asked the nurse.  excuse me who the hell is she?! this bigot is forcing her views onto the  mother, because she doesn't think the baby would grow up ""normal""? a  mother who's making the difficult decision to place her son up for adoption,  and a wonderful couple who wants to raise that child. what the hell right does  the nurse have to try to stop that? i hope they fire her.  i'm happy for the gay couple on becoming parents!",0.0,0.0,18 - 65+,07/10/15 05:37:30 AM PDT,https://www.facebook.com/LGBT-United-839497472793277I,News Feed on desktop computers or News Feed on mobile  devices,Unavailable,0.0,Unavailable,2015-07-10,41.5,MidAge,low,low,low
46,"obey the law and everything will be ok, they say",0.0,0.0,18 - 65+,07/27/15 12:42:42 AM PDT,https://www.facebook.com/shootusa,News Feed on desktop computers or News Feed on mobile devices,Unavailable,0.0,Unavailable,2015-07-27,41.5,MidAge,low,low,low
47,"obey the law and everything will be ok, they say",0.0,0.0,18 - 65+,07/24/15 02:24:10 AM PDT,https://www.facebook.com/shootusa,News Feed on desktop computers or News Feed on mobile devices,Unavailable,0.0,Unavailable,2015-07-24,41.5,MidAge,low,low,low
53,join us because we care. black matters!,0.0,0.0,18 - 65+,07/13/15 07:13:40 AM PDT,https://www.facebook.com/blackmattersus/,News Feed on desktop computers or News Feed on mobile devices,Unavailable,0.0,Unavailable,2015-07-13,41.5,MidAge,low,low,low
54,join us because we care. black matters!,12127.0,201428.0,18 - 65+,07/13/15 07:20:58 AM PDT,https://www.facebook.com/blackmattersus/,News Feed on desktop computers or News Feed on mobile devices,Unavailable,53424.95,RUB,2015-07-13,41.5,MidAge,high,high,high
64,join us. because we care,25.0,500.0,18 - 65+,07/10/15 01:03:31 AM PDT,https://www.facebook.com/Black-Matters-1579673598947501/,News Feed on desktop computers or News Feed on mobile devices,Unavailable,340.34,RUB,2015-07-10,41.5,MidAge,high,mid,mid
82,fast-growing black community. latest news and everyday updates.,6.0,191.0,18 - 65+,07/10/15 01:02:58 AM PDT,https://www.facebook.com/Black-Matters-1579673598947501/,News Feed on desktop computers or News Feed on mobile devices,Unavailable,257.25,RUB,2015-07-10,41.5,MidAge,mid,mid,mid
83,join us. because we care,30.0,613.0,18 - 65+,07/10/15 01:03:32 AM PDT,https://www.facebook.com/Black-Matters-1579673598947501/,News Feed on desktop computers or News Feed on mobile devices,Unavailable,468.0,RUB,2015-07-10,41.5,MidAge,high,mid,mid
92,fast-growing black community. latest news and everyday updates.,27.0,608.0,18 - 65+,07/10/15 01:03:03 AM PDT,https://www.facebook.com/Black-Matters-1579673598947501/,News Feed on desktop computers or News Feed on mobile devices,Unavailable,445.3,RUB,2015-07-10,41.5,MidAge,high,mid,mid
94,keeping eye on our brother's cases and much more,0.0,0.0,18 - 65+,07/13/15 07:17:59 AM PDT,https://www.facebook.com/blackmattersus/,News Feed on desktop computers or News Feed on mobile devices,Unavailable,0.0,Unavailable,2015-07-13,41.5,MidAge,low,low,low
95,keeping eye on our brother's cases and much more,4366.0,69296.0,18 - 65+,07/13/15 07:20:58 AM PDT,https://www.facebook.com/blackmattersus/,News Feed on desktop computers or News Feed on mobile devices,Unavailable,20446.19,RUB,2015-07-13,41.5,MidAge,high,high,high
100,keeping eye on our brother's cases and much more,0.0,0.0,18 - 65+,07/13/15 07:18:00 AM PDT,https://www.facebook.com/blackmattersus/,News Feed on desktop computers or News Feed on mobile devices,Unavailable,0.0,Unavailable,2015-07-13,41.5,MidAge,low,low,low
101,keeping eye on our brother's cases and much more,5155.0,79112.0,18 - 65+,07/13/15 07:20:58 AM PDT,https://www.facebook.com/blackmattersus/,News Feed on desktop computers or News Feed on mobile devices,Unavailable,23298.73,RUB,2015-07-13,41.5,MidAge,high,high,high
110,join us because we care. black matters!,0.0,0.0,18 - 65+,07/13/15 07:13:41 AM PDT,https://www.facebook.com/blackmattersus/,News Feed on desktop computers or News Feed on mobile devices,Unavailable,0.0,Unavailable,2015-07-13,41.5,MidAge,low,low,low
111,join us because we care. black matters!,7173.0,113435.0,18 - 65+,07/13/15 07:20:58 AM PDT,https://www.facebook.com/blackmattersus/,News Feed on desktop computers or News Feed on mobile devices,Unavailable,31741.49,RUB,2015-07-13,41.5,MidAge,high,high,high
114,"man dies after police use pepper spray during arrest in alabama        a man in alabama collapsed and died after officers sprayed him with pepper spray while arresting him after a chase, tuscaloosa police said saturday. police said ware ran into nearby woods and struggled with officers when they caught up with him. officers sprayed him with oleoresin capsicum, more commonly known as pepper spray, according to police. the chemical agent debilitates a person by causing temporary blindness and irritating a person's nose and throat. the six officers who were involved in ware's case will remain on duty during an investigation, according to police. officials said police car dash cam and body camera footage of the incident would be released after that investigation. this tragedy happen accidentally, and probably the police officers didn't wish death upon him, because they tried to give him first aid. however, the man is dead and there is no chance to rewind and bring him back. he's gone forever, but the cops will remain on duty and get away with this murder. is this acceptable? we will know about he process of detention after the investigation is over. let's wait and keep our eyes open. black lives matter!",151.0,1236.0,18 - 65+,07/14/15 06:13:31 AM PDT,https://www.facebook.com/Black-Matters-1579673598947501/,News Feed on desktop computers or News Feed on mobile devices,Unavailable,303.3,RUB,2015-07-14,41.5,MidAge,high,mid,mid
115,"have you ever been mistreated or abused by racist police officers? do you want you story to be read by thousands of people?        we can make this happen easily! we can post your story in our community.lt's very important to us, because black people should stop struggling with racism and police brutality. if we all speak out - we can do it! we can obtain justice and equality. you can send your story to blackmattersus@gmail.com or you can message us via facebook anonym or not. we are not to judge, we are to share experience and support each other. so don't be shy and help the black community. united we stand!",46.0,584.0,18 - 65+,07/14/15 06:10:21 AM PDT,https://www.facebook.com/Black-Matters-1579673598947501/,News Feed on desktop computers or News Feed on mobile devices,Unavailable,218.95,RUB,2015-07-14,41.5,MidAge,mid,mid,mid
116,"unarmed black man on a horse allegedly strangled to death by white cop in mississippi        one of the last things that jonathan sanders, an unarmed black man, reportedly said before he died was, ""let me go. i can't breathe."" on wednesday night, a white police officer in the small town of stonewall, mississippi allegedly strangled sanders, a 39-year-old black horseman, with a flashlight before killing him in view of his family members. officer kevin herrington pulled sanders off a horse and choked him with a flashlight, sander's attorney, stewart parrish, initially told an abc affiliate. parrish later clarified that those allegations came from family members who witnessed the death. parrish said that sanders experienced ""some kind of asphyxiation"" during the altercation. sanders died on the scene and leaves behind two children. the last words of eric garner were ""i can't breathe,"" the last words of jonathan sanders were ""i can't breathe, let me go"". biting irony, isn't it? since when is it illegal to train your horse in close propinquity to your house? america was always (and it is now) a police state for black people.",1003.0,9042.0,18 - 65+,07/13/15 07:20:12 AM PDT,https://www.facebook.com/Black-Matters-1579673598947501/,News Feed on desktop computers or News Feed on mobile devices,Unavailable,1615.11,RUB,2015-07-13,41.5,MidAge,high,high,high
117,"""i cant breathe"" symbolize an anger and frustration over the relationship between law enforcement and black people in america.",7.0,45.0,18 - 65+,07/16/15 02:22:00 AM PDT,https://www.facebook.com/Black-Matters-1579673598947501/,News Feed on desktop computers or News Feed on mobile devices,Unavailable,10.31,RUB,2015-07-16,41.5,MidAge,low,mid,low
118,"ta-nehisi coates on growing up in west baltimore        the famous african-american writer ta-nehisi coates grew up in west baltimore with people who lost a child whether to the streets, to guns or to jail. today, his goal is to protect his son from the different forms of violence that he experienced in school and on the streets. people of color have been dealing with injustice ever since they crossed the north american continent. for instance, in west baltimore, ta-nehisi was trained not to go to the neighborhoods unless you know this place. he was told that you cannot tolerate anybody attempting any physically violent threat to you. moreover, his mom was feared that her children would get arrested. what does it mean? undoubtedly, black americans were afraid of police, improper procedure, injustice or what is worse, being killed by police officer. that's why the nationwide furor over the growing number of unarmed black men fatally shot by police officers has put the public on a new trend in america. in fact, this new trend caused disproportionate number of unarmed people of color killed by police. how dangerous is to live in your area today?",18.0,327.0,18 - 65+,07/15/15 08:23:22 AM PDT,https://www.facebook.com/Black-Matters-1579673598947501/,News Feed on desktop computers or News Feed on mobile devices,Unavailable,157.72,RUB,2015-07-15,41.5,MidAge,mid,mid,mid
119,"black church vandalized for the third time in a row on florida's space coast. was it a hate-crime?        a predominantly melbourne black church was vandalized for the third time in six months. according to the melbourne police department, the vandal bought axes to chop through access points to get in. church bishop jacquelyn gordon said that the church was in the process of development since they moved two years ago into 125,000 foot industrial complex. moreover, the message ""ss charleston 2"" was found on the car nearby the church, which raised concerns about church security. ss charleston 2 indicates the tragedy in charleston when nine people were shot to death by white supremacist dylann roof at emanuel ame church. before, the church members found the words ""we see u"" that were painted in the radical emblem of the nazi party swastika. how many hateful people living in america today? what of these people are getting their hatred and racism from their parents or friends? what if it is a hate crime? has the government created a fund to assist this church?",45.0,672.0,18 - 65+,07/15/15 08:22:39 AM PDT,https://www.facebook.com/Black-Matters-1579673598947501/,News Feed on desktop computers or News Feed on mobile devices,Unavailable,262.75,RUB,2015-07-15,41.5,MidAge,mid,mid,mid
120,"amandla stenberg: black female bodies are treated as less than human        ""do black females lives matter, too?"" that's the big question 16-year-old amandla stenberg posed on instagram on sunday. the powerful post broke down the cultural double standards that plague black women every day. ""black features are beautiful, black women are not,"" stenberg wrote. ""white women are paragons of virtue and desire, black women are objects of fetishism and brutality. this, at least, seems to be the mentality surrounding black femininity and beauty in a society built upon eurocentric beauty standards."" everybody knows that racism is alive and prospering in america. however, all the news about killing black men and black teenagers, police brutality, unfair sentences and other issues, distract us from the fact that black women are being abused in the most violent ways. usually they can't stand up for themselves unlike men, so they endure and suffer. in modern america black women experience more depression than probably during slavery, when everything was obvious, but now racism is hidden behind the mask of tolerance.",113.0,1080.0,18 - 65+,07/15/15 03:35:13 AM PDT,https://www.facebook.com/Black-Matters-1579673598947501/,News Feed on desktop computers or News Feed on mobile devices,Unavailable,331.57,RUB,2015-07-15,41.5,MidAge,high,mid,mid
121,"new york city agrees to pay family of eric garner $5.9 million        new york city has agreed to pay the estate of eric garner $5.9 million to settle a lawsuit over his death after he was placed in a chokehold by a new york police department officer. the city didn't admit fault in the settlement, the comptroller's office said in announcing the accord monday evening. onathan moore, an attorney for the family, said the city made its offer of $5.9 million monday and the garner family, in his office, agreed unanimously to end the case. ""there is no amount of money that would compensate them for their loss,"" mr. moore said. ""eric garner is dead. he had no reason to die on that day. whatever you think he was doing, he shouldn't have died."" yeah right, money won't bring eric back. he's gone forever, and his his family knows that. but anyway, it's some sort of victory. it's way better than nothing. rest in peace, eric garner. no justice, no peace.",181.0,1662.0,18 - 65+,07/15/15 03:34:05 AM PDT,https://www.facebook.com/Black-Matters-1579673598947501/,News Feed on desktop computers or News Feed on mobile devices,Unavailable,424.29,RUB,2015-07-15,41.5,MidAge,high,mid,mid
122,"cleveland judge won't be forced to issue warrants in rice shooting        a divided ohio appeals court panel on friday said it would not force a municipal judge to issue arrest warrants for cleveland police officers involved in the fatal shooting of 12-year-old tamir rice in a city park last november. cleveland municipal court judge ronald adrine in june found probable cause for officer timothy loehmann, who shot rice, and his partner, frank garmback, to face charges in the shooting. loehmann shot rice twice within seconds of arriving outside a city recreation center on nov. 22 in response to an emergency call of a man with a gun. rice, who was playing with an airsoft-type replica handgun that shoots pellets, died the next day. by any means the justice system is trying to justify the cops, who should've been never employed even. they shot the poor kid in 2 seconds after they arrived, not even having time to understand the situation. everyday police use excessive force and weapons against unarmed people. killers in uniform... let's honor tamir's memory one more time.",173.0,1514.0,18 - 65+,07/14/15 06:13:13 AM PDT,https://www.facebook.com/Black-Matters-1579673598947501/,News Feed on desktop computers or News Feed on mobile devices,Unavailable,269.17,RUB,2015-07-14,41.5,MidAge,mid,mid,mid
123,"teen shot by st. louis police paralyzed; mom laments gun violence        a teenager shot by city police is paralyzed below the waist, his mother said sunday as her family copes with another episode of gun violence. not seven years ago, her teenage daughter was accidentally shot to death. this time, a firearm in the hand of her son, brandon claxton, 16, prompted an officer to shoot him three times about 7:15 p.m. saturday in a housing complex in the 2500 block of hodiamont avenue, officials said. police encountered him while responding to a call about someone with a stolen pistol. his mother said that she respected the police and that her son ""shouldn't have had the gun."" but from what witnesses have told her, she said, ""they didn't have to shoot him down like that."" one of three witnesses interviewed sunday told a reporter that brandon did have a gun in his hand. but all three said that he did not point a weapon at anyone as he tried to run from officers. when a white guy walks around with a rifle, nobody bats an eye. when a black guy walks with a pistol (or even a toy gun) - he'll be immediately shot by the police. have you ever heard about open carry in the united states? then here we go. racial prejudice at its finest. our condolences to the family.",205.0,1237.0,18 - 65+,07/14/15 06:12:50 AM PDT,https://www.facebook.com/Black-Matters-1579673598947501/,News Feed on desktop computers or News Feed on mobile devices,Unavailable,252.08,RUB,2015-07-14,41.5,MidAge,mid,mid,mid
124,"'hands up, don't shoot' was built on pain. we don't ask police to hug us, we only ask them to stop killing black men. because we are disproportionally killed by cops over and over again.",2.0,15.0,18 - 65+,07/17/15 06:33:37 AM PDT,https://www.facebook.com/Black-Matters-1579673598947501/,News Feed on desktop computers or News Feed on mobile devices,Unavailable,4.92,RUB,2015-07-17,41.5,MidAge,low,low,low
125,"90-year-old wwii veteran is evicted on stretcher. the wwii veteran johnnie h. hodges refused to leave his house after he was not able to pay his mortgage while caring for his sick wife. police and ambulance workers had to carry him away on a stretcher. a 90-year-old navy veteran lived in his buffalo home with his wife for decades. but about four years ago; he was taking care of his wife, who had alzheimer's disease and spent all his income on her rehabilitation. in the process, he defaulted on his mortgage and amassed a huge debt totaling $73;000 to m&t bank. unfortunately, due to his default on his mortgage loan payments, he was evicted from his house on a stretcher. why does the u.s. government treat military veterans absolutely disgracefully? why the wwii veterans are literally being treated like human garbage by their own government? how potentially disabled veteran was evicted from his house? how come homelessness and unemployment among american veterans is much higher today than for the general population of the united states of america?",10.0,28.0,18 - 65+,07/17/15 06:33:04 AM PDT,https://www.facebook.com/Black-Matters-1579673598947501/,News Feed on desktop computers or News Feed on mobile devices,Unavailable,8.85,RUB,2015-07-17,41.5,MidAge,low,mid,low
126,what differences do you see in the picture below? what do you think is the difference between police attitude towards white citizens and black citizens? think about it.,3.0,18.0,18 - 65+,07/17/15 06:32:46 AM PDT,https://www.facebook.com/Black-Matters-1579673598947501/,News Feed on desktop computers or News Feed on mobile devices,Unavailable,4.45,RUB,2015-07-17,41.5,MidAge,low,low,low
